drugName,url,description
Florastor,https://www.drugs.com/mtm/florastor.html,"florastor is a specific form of yeast also known as brewer's yeast, hansen cbs 5926, levure de boulangerie, and probiotic. florastor has been used as a probiotic, or ""friendly bacteria,"" to prevent the growth of harmful bacteria in the stomach and intestines. florastor is likely effective in alternative medicine as an aid in preventing diarrhea caused by taking antibiotics, or by using a feeding tube. this medicine is also likely effective in treating diarrhea in babies and children. florastor has been used as a possibly effective aid in preventing the recurrence of diarrhea caused by clostridium difficile (c. difficile). however, this product may not be effective in treating the first episodes of this type of diarrhea. this medicine is also possibly effective in treating ""traveler's diarrhea,"" diarrhea in people with hiv, and stomach ulcers caused by helicobacter pylori. other uses not proven with research have included irritable bowel disease, crohn's disease, ulcerative colitis, cystic fibrosis, urinary tract infections, yeast infections, lactose intolerance, and other conditions. it is not certain whether florastor is effective in treating any medical condition. medicinal use of this product has not been approved by the fda. this medicine should not be used in place of medication prescribed for you by your doctor. florastor is often sold as an herbal supplement. there are no regulated manufacturing standards in place for many herbal compounds and some marketed supplements have been found to be contaminated with toxic metals or other drugs. herbal/health supplements should be purchased from a reliable source to minimize the risk of contamination. florastor may also be used for purposes not listed in this product guide."
Flovent,https://www.drugs.com/flovent.html,flovent (fluticasone) is a corticosteroid. it prevents the release of substances in the body that cause inflammation. flovent is used to prevent asthma attacks. this medicine will not treat an asthma attack that has already begun. flovent is sometimes used together with steroid medicine taken by mouth. this medicine is for use in adults and children who are at least 4 years old.
Flovent HFA,https://www.drugs.com/mtm/flovent-hfa.html,"flovent hfa is a steroid that is used to prevent asthma attacks in adults and children. this medicine is sometimes used together with steroid medicine taken by mouth. flovent brands of fluticasone inhalation may be used in children as young as 4 years old. arnuity ellipta should not be used in children younger than 5 years old, and armonair should not be used in anyone younger than 12 years old. fluticasone may also be used for purposes not listed in this medication guide."
Fluconazole,https://www.drugs.com/mtm/fluconazole.html,"fluconazole is an antifungal medicine. fluconazole is used to treat infections caused by fungus, which can invade any part of the body including the mouth, throat, esophagus, lungs, bladder, genital area, and the blood. fluconazole is also used to prevent fungal infection in people who have a weak immune system caused by cancer treatment, bone marrow transplant, or diseases such as aids. fluconazole is also used to treat a certain type of meningitis in people with hiv or aids. fluconazole may also be used for purposes not listed in this medication guide."
Fludrocortisone,https://www.drugs.com/mtm/fludrocortisone.html,"fludrocortisone is a steroid that helps reduce inflammation in the body. fludrocortisone is used to treat conditions in which the body does not produce enough of its own steroids, such as addison's disease, and salt-losing adrenogenital syndrome. fludrocortisone may also be used for purposes not listed in this medication guide."
Fluocinonide,https://www.drugs.com/fluocinonide-topical.html,"fluocinonide is a potent corticosteroid that prevents the release of substances in the body that cause inflammation. fluocinonide topical (for the skin) is used to treat inflammation and itching caused by plaque psoriasis and skin conditions that respond to steroid medication. fluocinonide topical is available in a cream, gel, ointment, and solution."
Fluoxetine,https://www.drugs.com/fluoxetine.html,"fluoxetine is a selective serotonin reuptake inhibitor (ssri) antidepressant. fluoxetine inhibits the uptake of serotonin by a nerve cells (neurons) and helps people with depression, panic, anxiety, or obsessive-compulsive symptoms. fluoxetine is a prescription medicine used to treat major depressive disorder, bulimia nervosa (an eating disorder), obsessive-compulsive disorder, panic disorder, and premenstrual dysphoric disorder (pmdd). fluoxetine is sometimes used together with another medication called olanzapine (zyprexa) to treat manic depression caused by bipolar disorder. this combination is also used to treat depression after at least 2 other medications have been tried without successful treatment of symptoms. if you also take olanzapine (zyprexa), read the zyprexa medication guide and all patient warnings and instructions provided with that medication."
Fluticasone,https://www.drugs.com/mtm/fluticasone-topical.html,fluticasone is a potent steroid that helps reduce inflammation in the body. fluticasone topical (for the skin) is used to treat the inflammation and itching caused by eczema or skin conditions that respond to steroid medication. fluticasone topical may also be used for purposes not listed in this medication guide.
Fluticasone and salmeterol,https://www.drugs.com/mtm/fluticasone-and-salmeterol.html,"fluticasone and salmeterol inhalation is a steroid and bronchodilator combination medicine that is used to prevent asthma attacks. it is also used to prevent flare-ups or worsening of chronic obstructive pulmonary disease (copd) associated with chronic bronchitis and/or emphysema. in people with copd, fluticasone and salmeterol is for long-term treatment. in people with asthma, fluticasone and salmeterol is for short-term treatment until symptoms are well controlled with with other medicines. advair diskus is for use in adults and children who are at least 4 years old. advair hfa and airduo respiclick are for use in adults and children who are at least 12 years old. fluticasone and salmeterol may also be used for purposes not listed in this medication guide."
Fluvoxamine,https://www.drugs.com/mtm/fluvoxamine.html,"fluvoxamine is a selective serotonin reuptake inhibitor (ssri) antidepressant. fluvoxamine affects chemicals in the brain that may be unbalanced in people with obsessive-compulsive symptoms. fluvoxamine is used to treat social anxiety disorder (social phobia), or obsessive-compulsive disorders involving recurring thoughts or actions. fluvoxamine may also be used for purposes not listed in this medication guide."
Folic Acid,https://www.drugs.com/folic_acid.html,"folic acid is a type of b vitamin that is normally found in foods such as dried beans, peas, lentils, oranges, whole-wheat products, liver, asparagus, beets, broccoli, brussels sprouts, and spinach. folic acid helps your body produce and maintain new cells, and also helps prevent changes to dna that may lead to cancer. as a medication, folic acid is used to treat folic acid deficiency and certain types of anemia (lack of red blood cells) caused by folic acid deficiency. folic acid is sometimes used in combination with other medications to treat pernicious, aplastic, or normocytic anemia. however it will not treat vitamin b12 deficiency and will not prevent possible damage to the spinal cord. take all of your medications as directed."
Formoterol,https://www.drugs.com/mtm/formoterol-inhalation.html,"formoterol inhalation is used to control the symptoms of chronic obstructive pulmonary disease (copd), including chronic bronchitis and emphysema. formoterol may also be used for purposes not listed in this medication guide."
Fosamax,https://www.drugs.com/fosamax.html,"fosamax (alendronate) is a bisphosphonate (bis fos fo nayt) medicine that alters bone formation and breakdown in the body. this can slow bone loss and may help prevent bone fractures. fosamax is used in women to treat or prevent osteoporosis caused by menopause and in men and women to treat osteoporosis caused by taking steroids. fosamax is also used to increase bone mass in men who have osteoporosis, and to treat paget's disease of bone in men and women."
Furosemide,https://www.drugs.com/furosemide.html,"furosemide is a loop diuretic (water pill) that prevents your body from absorbing too much salt. this allows the salt to instead be passed in your urine. furosemide is used to treat fluid retention (edema) in people with congestive heart failure, liver disease, or a kidney disorder such as nephrotic syndrome. furosemide is also used to treat high blood pressure (hypertension)."
Gabapentin,https://www.drugs.com/gabapentin.html,"gabapentin is an anti-epileptic drug, also called an anticonvulsant. it affects chemicals and nerves in the body that are involved in the cause of seizures and some types of pain. gabapentin is used together with other medicines to treat partial seizures in adults and children at least 3 years old. gabapentin is also used to treat neuropathic pain (nerve pain) caused by herpes virus or shingles (herpes zoster) in adults. use only the brand and form of gabapentin your doctor has prescribed. check your medicine each time you get a refill to make sure you receive the correct form. the gralise brand of gabapentin is indicated for the management of neuropathic pain only. it is not used for epilepsy. horizant is used to treat nerve pain and restless legs syndrome (rls). the neurontin brand is used to treat seizures in adults and children who are at least 3 years old, in addition to neuropathic pain."
Galantamine,https://www.drugs.com/mtm/galantamine.html,"galantamine improves the function of nerve cells in the brain. it works by preventing the breakdown of a chemical called acetylcholine (ah see til ko leen). people with dementia usually have lower levels of this chemical, which is important for the processes of memory, thinking, and reasoning. galantamine is used to treat mild to moderate alzheimer's type dementia. galantamine may also be used for purposes not listed in this medication guide."
Garamycin,https://www.drugs.com/mtm/garamycin.html,garamycin is an antibiotic that fights bacteria. garamycin is used to treat severe or serious bacterial infections. garamycin may also be used for purposes not listed in this medication guide.
Gardasil,https://www.drugs.com/mtm/gardasil.html,"human papillomavirus (hpv) can cause genital warts, cancer of the cervix, anal cancer, and various cancers of the vulva or vagina. gardasil (hpv quadrivalent vaccine) and gardasil 9 (hpv 9-valent vaccine) are used in both females and males. another form of hpv vaccine (cervarix) is used only in females. this medication guide provides information only for gardasil (hpv quadrivalent vaccine). hpv quadrivalent vaccine is used in girls and young women ages 9 through 26 to prevent cervical/vaginal/anal cancers caused by certain types of hpv. hpv quadrivalent vaccine is also used in boys and young men ages 9 through 26 to prevent anal cancer or genital warts caused by certain types of hpv. you may receive this vaccine even if you have already had genital warts, or had a positive hpv test or abnormal pap smear in the past. however, this vaccine will not treat active genital warts or hpv-related cancers, and it will not cure hpv infection. hpv quadrivalent vaccine only prevents diseases caused by hpv types 6, 11, 16, and 18. it will not prevent diseases caused by other types of hpv. the centers for disease control and prevention (cdc) recommends hpv vaccine for all boys and girls ages 11 or 12 years old. the vaccine is also recommended in teenage boys and girls who have not already received the vaccine or have not completed all booster shots. like any vaccine, the hpv quadrivalent vaccine may not provide protection from disease in every person. hpv quadrivalent vaccine may also be used for other purposes not listed in this medication guide."
Garlic,https://www.drugs.com/mtm/garlic.html,"garlic is an herb also known as ail, ajo, allii sativi bulbus, allium, allium sativum, camphor of the poor, da suan, lasun, lasuna, nectar of the gods, poor man's treacle, rason, rust treacle, or stinking rose. garlic is a commonly used food and flavoring agent. when used as a food product, garlic is not likely to produce health benefits or side effects. when used as a medicinal product, garlic may produce both desired and unwanted effects on the body. garlic products sold as health supplements may vary widely in amount of allicin, the active ingredient in garlic. allicin is unstable and can be reduced in garlic products that are aged to reduce odor. odorless garlic may contain little to no allicin. the lower the amount of allicin, the less effective a garlic product might be. garlic taken orally (by mouth) has been used in alternative medicine as a possibly effective aid in treating high blood pressure, coronary artery disease (hardened arteries), stomach cancer, colon cancer or rectal cancer, and in preventing tick bites. garlic applied to the skin may also be possibly effective in treating fungal skin infections such as ringworm, jock itch, or athlete's foot. garlic has also been used to treat high cholesterol, stomach ulcers caused by h. pylori, cancer, or circulation problems in the legs. however, research has shown that garlic may not be effective in treating these conditions. other uses not proven with research have included preventing the common cold, and improving urination problems caused by an enlarged prostate. it is not certain whether garlic is effective in treating any medical condition. medicinal use of this product has not been approved by the fda. garlic should not be used in place of medication prescribed for you by your doctor. garlic is often sold as an herbal supplement. there are no regulated manufacturing standards in place for many herbal compounds and some marketed supplements have been found to be contaminated with toxic metals or other drugs. herbal/health supplements should be purchased from a reliable source to minimize the risk of contamination. garlic may also be used for purposes not listed in this product guide."
Gas-X,https://www.drugs.com/mtm/gas-x.html,"gas-x allows gas bubbles in the stomach and intestines to come together more easily, which allows for easier passage of gas. gas-x is used to relieve painful pressure caused by excess gas in the stomach and intestines. this medicine is for use in babies, children, and adults. gas-x may also be used for purposes not listed in this medication guide."
Gaviscon,https://www.drugs.com/mtm/gaviscon.html,"gaviscon are antacids that can lower the acidity of stomach acid. gaviscon is a combination medicine that is used to treat heartburn, acid indigestion, sour stomach, or upset stomach. .gaviscon is also used to provide temporary relief from heartburn and acid indigestion caused by acid reflux. gaviscon may also be used for purposes not listed in this medication guide."
Gaviscon Extra Strength,https://www.drugs.com/mtm/gaviscon-extra-strength.html,"gaviscon extra strength are antacids that can lower the acidity of stomach acid. gaviscon extra strength is a combination medicine that is used to treat heartburn, acid indigestion, sour stomach, or upset stomach. gaviscon extra strength may also be used for purposes not listed in this medication guide."
Gemcitabine,https://www.drugs.com/mtm/gemcitabine.html,"gemcitabine is used to treat cancers of the pancreas, lung, ovary, and breast. gemcitabine is sometimes given with other cancer medicines, or when other cancer treatments did not work or have stopped working. gemcitabine may also be used for purposes not listed in this medication guide."
Gemfibrozil,https://www.drugs.com/gemfibrozil.html,gemfibrozil helps reduce cholesterol and triglycerides (fatty acids) in the blood. high levels of these types of fat in the blood are associated with an increased risk of atherosclerosis (clogged arteries). gemfibrozil is used together with diet to treat very high cholesterol and triglyceride levels. it is used to decrease a persons risk of pancreatitis when triglyceride levels are very high. it is also used to decrease the risk of heart disease in certain patients with high cholesterol.
Gemzar,https://www.drugs.com/gemzar.html,"gemzar (gemcitabine) is a cancer medication that interferes with the growth and spread of cancer cells in the body. gemzar is used to treat cancers of the pancreas, lung, ovary, and breast. gemzar is sometimes given with other cancer medicines, or when other cancer treatments did not work or have stopped working."
Genotropin,https://www.drugs.com/mtm/genotropin.html,"genotropin is a form of human growth hormone important for the growth of bones and muscles. genotropin is used to treat growth failure in children and adults who lack natural growth hormone. this includes people with short stature due to turner syndrome, prader-willi syndrome, short stature at birth with no catch-up growth, and other causes. genotropin may also be used for purposes not listed in this medication guide."
Gentamicin,https://www.drugs.com/mtm/gentamicin.html,gentamicin is an antibiotic that fights bacteria. gentamicin is used to treat severe or serious bacterial infections. gentamicin may also be used for purposes not listed in this medication guide.
Genvoya,https://www.drugs.com/genvoya.html,"genvoya is a tablet containing a combination of cobicistat, elvitegravir, emtricitabine, and tenofovir. cobicistat reduces the action of enzymes in your liver that break down certain antiviral medicines. this allows the antiviral medicines to be used more safely and effectively at lower doses. elvitegravir, emtricitabine and tenofovir are antiviral medicines that prevent human immunodeficiency virus (hiv) from multiplying in your body. hiv can cause acquired immunodeficiency syndrome (aids). genvoya is used to treat hiv in adults and children who are at least 12 years old and who weigh at least 55 pounds (25 kilograms). genvoya is not a cure for hiv or aids."
Geodon,https://www.drugs.com/geodon.html,geodon (ziprasidone) is an antipsychotic medication. it works by changing the effects of chemicals in the brain. geodon is used to treat schizophrenia and the manic symptoms of bipolar disorder (manic depression) in adults and children who are at least 10 years old. it is available as an oral (by mouth) treatment as an injection. geodon injection is used to quickly treat agitation in people with schizophrenia.
Ginkgo Biloba,https://www.drugs.com/mtm/ginkgo-biloba.html,"ginkgo biloba is an herb also known as ginkgo biloba biloba, abricot argent japonais, adiantifolia, arbre aux cus, arbre du ciel, arbre fossile, bai guo ye, baiguo, extrait de ginkgo biloba, fossil tree, graine de ginkgo biloba, herba ginkgo biloba biloba, japanese silver apricot, kew tree, maidenhair tree, noyer du japon, pei go su ye, salisburia adiantifolia, yen xing, yinhsing, and other names. ginkgo biloba has been used in alternative medicine as a possibly effective aid in improving mental function or treating anxiety, dementia, leg pain caused by blood circulation problems, premenstrual symptoms, vision problems caused by glaucoma or diabetes, vertigo (dizziness), or a movement disorder (tardive dyskinesia) caused by taking certain antipsychotic drugs. ginkgo biloba has also been used to treat seasonal affective disorder, age-related memory loss, asthma, tinnitus (ringing in the ears), high blood pressure, multiple sclerosis, cocaine addiction, or sexual problems caused by taking antidepressants. however, research has shown that ginkgo biloba may not be effective in treating these conditions. research has shown that ginkgo biloba is not likely to be effective in treating heart disease. other uses not proven with research have included altitude sickness, macular degeneration (age-related vision loss), attention deficit disorder, dyslexia, vitiligo (discolored skin), migraines, bronchitis, digestion problems, urination problems, skin sores, high cholesterol, raynaud's syndrome, fibromyalgia, chronic fatigue syndrome, blood clots, stroke, and cancer. it is not certain whether ginkgo biloba is effective in treating any medical condition. medicinal use of this product has not been approved by the fda. ginkgo biloba should not be used in place of medication prescribed for you by your doctor. ginkgo biloba is often sold as an herbal supplement. there are no regulated manufacturing standards in place for many herbal compounds and some marketed supplements have been found to be contaminated with toxic metals or other drugs. herbal/health supplements should be purchased from a reliable source to minimize the risk of contamination. ginkgo biloba may also be used for purposes not listed in this product guide."
Gleevec,https://www.drugs.com/gleevec.html,"gleevec (imatinib) interferes with the growth of some cancer cells. gleevec is used to treat certain types of leukemia (blood cancer), bone marrow disorders, and skin cancer. gleevec is also used to treat certain tumors of the stomach and digestive system."
Glimepiride,https://www.drugs.com/mtm/glimepiride.html,glimepiride is an oral diabetes medicine that is used together with diet and exercise to improve blood sugar control in adults with type 2 diabetes mellitus. glimepiride is not for treating type 1 diabetes. glimepiride may also be used for purposes not listed in this medication guide.
Glipizide,https://www.drugs.com/glipizide.html,glipizide is an oral diabetes medicine that helps control blood sugar levels by helping your pancreas produce insulin. glipizide is used together with diet and exercise to improve blood sugar control in adults with type 2 diabetes mellitus. glipizide is not for treating type 1 diabetes.
Glucagon,https://www.drugs.com/glucagon.html,"glucagon is a hormone that increases blood sugar levels. it also slows involuntary muscle movements of the stomach and intestines that aid in digestion. glucagon is a prescription medicine used to treat very low blood sugar (hypoglycemia). glucagon is also used to stop stomach movement during radiologic (x-ray) examinations undertaken to diagnose certain disorders of the stomach or intestines. glucagon is available as an auto-injector, prefilled syringe, or injection vial."
Glucophage,https://www.drugs.com/glucophage.html,"glucophage (metformin) is an oral diabetes medicine that helps control blood sugar levels. glucophage is used together with diet and exercise to improve blood sugar control in adults with type 2 diabetes mellitus. glucophage is sometimes used together with insulin or other medications, but metformin is not for treating type 1 diabetes."
Glucosamine,https://www.drugs.com/mtm/glucosamine.html,"glucosamine is sugar protein that helps your body build cartilage (the hard connective tissue located mainly on the bones near your joints). glucosamine is a naturally occurring substance found in bones, bone marrow, shellfish and fungus. glucosamine has been used in alternative medicine as an aid to relieving joint pain, swelling, and stiffness caused by arthritis. not all uses for glucosamine have been approved by the fda. glucosamine should not be used in place of medication prescribed for you by your doctor. glucosamine is often sold as an herbal supplement. there are no regulated manufacturing standards in place for many herbal compounds and some marketed supplements have been found to be contaminated with toxic metals or other drugs. herbal/health supplements should be purchased from a reliable source to minimize the risk of contamination. glucosamine may also be used for purposes not listed in this product guide."
Glucosamine &amp; Chondroitin with MSM,https://www.drugs.com/mtm/glucosamine-chondroitin-with-msm.html,"chondroitin is a naturally occurring substance formed of sugar chains. chondroitin is believed to help the body maintain fluid and flexibility in the joints. glucosamine is a naturally occurring substance that is believed to help develop and renew cartilage (the hard connective tissue mainly located on bones near joints in the body), and keep it lubricated for better joint movement and flexibility. methylsulfonylmethane (msm) is a naturally occurring form of sulfur that helps support muscles and tendons in the body. chondroitin, glucosamine, and msm is a combination medicine that has been used in alternative medicine as a possibly effective aid in treating osteoarthritis, muscle damage caused by exercise, and other inflammatory joint disorders. it is not certain whether chondroitin, glucosamine, and msm is effective in treating any medical condition. medicinal use of this product has not been approved by the fda. this product should not be used in place of medication prescribed for you by your doctor. chondroitin, glucosamine, and msm is often sold as an herbal supplement. there are no regulated manufacturing standards in place for many herbal compounds and some marketed supplements have been found to be contaminated with toxic metals or other drugs. herbal/health supplements should be purchased from a reliable source to minimize the risk of contamination. chondroitin, glucosamine, and msm may also be used for purposes not listed in this product guide."
Glucotrol,https://www.drugs.com/glucotrol.html,glucotrol (glipizide) is an oral diabetes medicine that helps control blood sugar levels by helping your pancreas produce insulin. glucotrol is used together with diet and exercise to improve blood sugar control in adults with type 2 diabetes mellitus. glucotrol is not for treating type 1 diabetes.
