drugName,url,description
Rifaximin,https://www.drugs.com/mtm/rifaximin.html,rifaximin is used to treat travelers' diarrhea caused by escherichia coli (e. coli) in adults and children who are at least 12 years old. most people get this infection by eating food or drinking fluids that have been contaminated with the e. coli bacteria. rifaximin is also used to treat irritable bowel syndrome (ibs) in adults whose main symptom is diarrhea. rifaximin is also used to lower the risk of a decline in brain function in adults with liver failure. brain function can be affected when the liver stops working and cannot remove toxic substances from the body. rifaximin may also be used for purposes not listed in this medication guide.
Riluzole,https://www.drugs.com/mtm/riluzole.html,"riluzole is used to treat amyotrophic lateral sclerosis, also known as als or lou gehrig's disease. riluzole is not a cure for als, but it may delay progression of the disease and prolong your life. riluzole may also be used for purposes not listed in this medication guide."
Risedronate,https://www.drugs.com/mtm/risedronate.html,"risedronate is used to treat osteoporosis caused by menopause, or steroid use. risedronate is for use when you have a high risk of bone fracture due to osteoporosis. risedronate is also used to treat paget's disease of bone. risedronate may also be used for purposes not listed in this medication guide."
Risperdal,https://www.drugs.com/risperdal.html,risperdal (risperidone) is an antipsychotic medicine that works by changing the effects of chemicals in the brain. risperdal is used to treat schizophrenia in adults and children who are at least 13 years old. risperdal is also used to treat symptoms of bipolar disorder (manic depression) in adults and children who are at least 10 years old. risperdal is also used to treat symptoms of irritability in autistic children who are 5 to 16 years old.
Risperidone,https://www.drugs.com/risperidone.html,risperidone is an antipsychotic medicine that works by changing the effects of chemicals in the brain. risperidone is used to treat schizophrenia in adults and children who are at least 13 years old. risperidone is also used to treat symptoms of bipolar disorder (manic depression) in adults and children who are at least 10 years old. risperidone is also used to treat symptoms of irritability in autistic children who are 5 to 16 years old.
Ritalin,https://www.drugs.com/ritalin.html,"ritalin (methylphenidate) is a central nervous system stimulant. it affects chemicals in the brain and nerves that contribute to hyperactivity and impulse control. ritalin is used to treat attention deficit disorder (add), attention deficit hyperactivity disorder (adhd), and narcolepsy. ritalin may also be used for purposes not listed in this medication guide."
Rituxan,https://www.drugs.com/rituxan.html,rituxan (rituximab) is a cancer medicine that interferes with the growth and spread of cancer cells in the body. it is also used to treat other non-cancer conditions. rituxan is an intravenous (iv) infusion given by a healthcare professional. it is a prescription medicine used alone or in combination with other medicines to treat the following conditions: non-hodgkin's lymphoma or chronic lymphocytic leukemia in adults; rheumatoid arthritis in adults; granulomatosis with polyangiitis and microscopic polyangiitis (rare disorders that cause inflammation of blood vessels and other tissues in the body) in adults and children 2 years of age and older; or pemphigus vulgaris (a severe autoimmune reaction that causes blisters and breakdown of the skin and mucous membranes) in adults.
Rituximab,https://www.drugs.com/mtm/rituximab.html,rituximab is used alone or in combination with other medicines to treat the following conditions in adults: non-hodgkin's lymphoma or chronic lymphocytic leukemia; rheumatoid arthritis; or pemphigus vulgaris--a severe autoimmune reaction that causes blisters and breakdown of the skin and mucous membranes. rituximab is also used in adults and children at least 2 years old with certain rare disorders that cause inflammation of blood vessels and other tissues in the body. rituximab may also be used for purposes not listed in this medication guide.
Rivaroxaban,https://www.drugs.com/mtm/rivaroxaban.html,"rivaroxaban is used to treat or prevent blood clots (venous thromboembolism, or vte). blood clots can occur in the legs (deep vein thrombosis, dvt) or the lungs (pulmonary embolism, pe). blood clots can develop when you are very ill and cannot move around as much as normal, such as during or after a stay in the hospital. blood clots may also develop after knee or hip replacement surgery. rivaroxaban is sometimes used to lower your risk of a blood clot coming back after you have received treatment for blood clots for at least 6 months. rivaroxaban is also used in people with atrial fibrillation (a heart rhythm disorder) to lower the risk of stroke caused by a blood clot. rivaroxaban is also given together with aspirin to lower the risk of stroke, heart attack, or other serious heart problems in people with coronary artery disease (decreased blood flow to the heart) or peripheral artery disease (decreased blood flow to the legs). rivaroxaban may also be used for purposes not listed in this medication guide."
Rivastigmine,https://www.drugs.com/mtm/rivastigmine.html,rivastigmine is used to treat mild to moderate dementia caused by alzheimer's or parkinson's disease. rivastigmine is not a cure for alzheimer's or parkinson's disease. rivastigmine may also be used for purposes not listed in this medication guide.
Rizatriptan,https://www.drugs.com/mtm/rizatriptan.html,"rizatriptan is a headache medicine that narrows the blood vessels around the brain. rizatriptan also reduces substances in the body that can trigger headache pain, nausea, sensitivity to light and sound, and other migraine symptoms. rizatriptan is used to treat migraine headaches. rizatriptan will only treat a headache that has already begun. it will not prevent headaches or reduce the number of attacks. rizatriptan should not be used to treat a common tension headache, or a headache that causes loss of movement on one side of your body. use rizatriptan only if your condition has been confirmed by a doctor as migraine headaches. rizatriptan may also be used for purposes not listed in this medication guide."
Robaxin,https://www.drugs.com/robaxin.html,"robaxin (methocarbamol) is a muscle relaxer. it works by blocking nerve impulses (or pain sensations) that are sent to your brain. robaxin is used together with rest and physical therapy to treat skeletal muscle conditions such as pain or injury. robaxin injection is sometimes used in the treatment of tetanus, (lockjaw) which causes painful tightening of the muscles."
Rocephin,https://www.drugs.com/rocephin.html,"rocephin (ceftriaxone) is a cephalosporin (sef a low spor in) antibiotic. . it works by fighting bacteria in your body. rocephin is used to treat many kinds of bacterial infections, including severe or life-threatening forms such as e. coli, pneumonia, or meningitis. rocephin is also used to prevent infection in people having certain types of surgery."
Ropinirole,https://www.drugs.com/mtm/ropinirole.html,"ropinirole has some of the same effects as a chemical called dopamine, which occurs naturally in your body. low levels of dopamine in the brain are associated with parkinson's disease. ropinirole is used to treat symptoms of parkinson's disease (stiffness, tremors, muscle spasms, and poor muscle control). ropinirole is also used to treat restless legs syndrome (rls). only immediate-release ropinirole (requip) is approved to treat either parkinson symptoms or rls. extended-release ropinirole (requip xl) is approved only to treat parkinson symptoms. parkinson's and rls are two separate disorders. having one of these conditions will not cause you to have the other condition. ropinirole may also be used for purposes not listed in this medication guide."
Rosuvastatin,https://www.drugs.com/mtm/rosuvastatin.html,"rosuvastatin is used together with diet to lower blood levels of ""bad"" cholesterol (low-density lipoprotein, or ldl), to increase levels of ""good"" cholesterol (high-density lipoprotein, or hdl), and to lower triglycerides (a type of fat in the blood). rosuvastatin is also used to treat hereditary types of high cholesterol (hypercholesterolemia): the heterozygous type (inherited from one parent) or the homozygous type (inherited from both parents). for the heterozygous type, rosuvastatin can be used in children who are at least 8 years old. for the homozygous type, rosuvastatin can be used in children as young as 7 years old. the ezallor brand of rosuvastatin is for use only in adults. crestor is also used in adults to slow the progression of atherosclerosis (a build-up of plaque in blood vessels that can block blood flow). crestor is also used to lower the risk of stroke, heart attack, and other complications in men 50 years and older or women 60 years and older who have coronary heart disease or other risk factors. rosuvastatin may also be used for purposes not listed in this medication guide."
Rybelsus,https://www.drugs.com/rybelsus.html,rybelsus (semaglutide) is used together with diet and exercise to improve blood sugar control in adults with type 2 diabetes mellitus. rybelsus is usually given after other diabetes medicines have been tried without success. rybelsus is not for treating type 1 diabetes.
Saw Palmetto,https://www.drugs.com/mtm/saw-palmetto.html,"saw palmetto comes from a palm-like plant that grows in the southeast united states. the berries of this plant are used to make the capsule form of saw palmetto. saw palmetto is also known as american dwarf palm tree, baies du palmier scie, cabbage palm, chou palmiste, ju-zhong, palma enana americana, palmier nain, palmier scie, sabal, serenoa, and other names. saw palmetto blocks certain effects of certain hormones in the body and also has some anti-inflammatory actions. saw palmetto has been used in alternative medicine as a possibly effective aid in preventing complications from prostate surgery (such as blood loss or problems during surgery) and reducing the time spent in surgery and in the hospital after surgery. saw palmetto has been used to treat symptoms of enlarged prostate (benign prostatic hypertrophy, or bph), such as increased night-time urination or decreased urinary flow. however, research has shown that saw palmetto may not be effective in treating this condition. other uses not proven with research have included treating sore throat, cough, cold symptoms, asthma, bronchitis, migraine headache, male-pattern baldness, chronic pelvic pain and prostate swelling, bladder problems, prostate cancer, and other conditions. it is not certain whether saw palmetto is effective in treating any medical condition. medicinal use of this product has not been approved by the fda. saw palmetto should not be used in place of medication prescribed for you by your doctor. saw palmetto is often sold as an herbal supplement. there are no regulated manufacturing standards in place for many herbal compounds and some marketed supplements have been found to be contaminated with toxic metals or other drugs. herbal/health supplements should be purchased from a reliable source to minimize the risk of contamination. saw palmetto may also be used for other purposes not listed in this product guide."
Saxenda,https://www.drugs.com/saxenda.html,"saxenda (liraglutide) is similar to a hormone that occurs naturally in the body and helps control blood sugar, insulin levels, and digestion. saxenda is an injectable prescription medicine that may help some obese adults or overweight adults, who also have weight-related medical problems, to lose weight and keep the weight off. it is used together with diet and exercise. saxenda is not a weight-loss medicine or appetite suppressant. saxenda is not for treating type 1 or type 2 diabetes./p>"
Senna,https://www.drugs.com/senna.html,senna is a natural medicine containing sennosides that are derived from the leaves of the senna plant. sennosides irritate the lining of the bowel causing a laxative effect. senna has been used in alternative medicine as a laxative and an aid to treat constipation. not all uses for senna have been approved by the fda. it should not be used in place of medication prescribed for you by your doctor. senna is often sold as an herbal supplement. there are no regulated manufacturing standards in place for many herbal compounds and some marketed supplements have been found to be contaminated with toxic metals or other drugs. herbal/health supplements should be purchased from a reliable source to minimize the risk of contamination.
Senokot,https://www.drugs.com/mtm/senokot.html,"senna is also known as cassia senna, tinnevelly senna, indian senna, alexandrian senna, and khartoum senna. senna has been used in alternative medicine as an aid to treat constipation. not all uses for senna have been approved by the fda. senna should not be used in place of medication prescribed for you by your doctor. senna is often sold as an herbal supplement. there are no regulated manufacturing standards in place for many herbal compounds and some marketed supplements have been found to be contaminated with toxic metals or other drugs. herbal/health supplements should be purchased from a reliable source to minimize the risk of contamination. senna may also be used for purposes not listed in this product guide."
Sensipar,https://www.drugs.com/sensipar.html,"sensipar (cinacalcet) decreases levels of parathyroid hormone (pth), calcium, and phosphorous in the body. sensipar is used to treat hyperparathyroidism (overactive functioning of the parathyroid glands) in people who are on long-term dialysis for kidney disease. sensipar is also used to treat hypercalcemia (high levels of calcium in the blood) in people with cancer of the parathyroid gland, and in people with overactive parathyroid glands that cannot be treated surgically."
Seroquel,https://www.drugs.com/seroquel.html,seroquel (quetiapine) is an antipsychotic medicine. it works by changing the actions of chemicals in the brain. seroquel is used to treat schizophrenia in adults and children who are at least 13 years old. seroquel is used to treat bipolar disorder (manic depression) in adults and children who are at least 10 years old. seroquel is also used together with antidepressant medications to treat major depressive disorder in adults. seroquel may also be used for purposes not listed in this medication guide.
Sertraline,https://www.drugs.com/sertraline.html,"sertraline is an antidepressant in a group of drugs called selective serotonin reuptake inhibitors (ssris). sertraline affects chemicals in the brain that may be unbalanced in people with depression, panic, anxiety, or obsessive-compulsive symptoms. sertraline is used to treat depression, obsessive-compulsive disorder, anxiety disorders (including panic disorder and social anxiety disorder), post-traumatic stress disorder (ptsd), and premenstrual dysphoric disorder (pmdd)."
Sevelamer,https://www.drugs.com/mtm/sevelamer.html,sevelamer is a phosphate binder. sevelamer helps prevent hypocalcemia (low levels of calcium in the body) caused by elevated phosphorus. sevelamer is used to control phosphorus levels in people with chronic kidney disease who are on dialysis. sevelamer may also be used for purposes not listed in this medication guide.
Shingrix,https://www.drugs.com/shingrix.html,"shingrix is a vaccine used for the prevention of herpes zoster. herpes zoster is caused by the same virus (varicella) that causes chickenpox in children. when this virus becomes active again, it can cause herpes zoster, or shingles. shingrix helps prevent shingles. shingrix works by exposing you to a small dose of inactive virus, which causes the body to develop immunity to the disease. this vaccine will not treat an active infection that has already developed in the body. shingrix is used to prevent herpes zoster virus (shingles) in people age 50 and older, including people who previously received a live zoster vaccine (zostavax). shingrix will not treat chickenpox, shingles, or nerve pain caused by shingles (post-herpetic neuralgia)."
Sildenafil,https://www.drugs.com/sildenafil.html,"sildenafil relaxes muscles of the blood vessels and increases blood flow to particular areas of the body. sildenafil under the name viagra is used to treat erectile dysfunction (impotence) in men. another brand of sildenafil is revatio, which is used to treat pulmonary arterial hypertension and improve exercise capacity in men and women. do not take viagra while also taking revatio."
Simethicone,https://www.drugs.com/mtm/simethicone.html,"simethicone allows gas bubbles in the stomach and intestines to come together more easily, which allows for easier passage of gas. simethicone is used to relieve painful pressure caused by excess gas in the stomach and intestines. simethicone is for use in babies, children, and adults. simethicone may also be used for purposes not listed in this medication guide."
Simponi,https://www.drugs.com/simponi.html,"simponi (golimumab) reduces the effects of a substance in the body that can cause inflammation. simponi is used to treat rheumatoid arthritis, psoriatic arthritis, ankylosing spondylitis, or ulcerative colitis. simponi is sometimes used with another medicine called methotrexate (rheumatrex, trexall)."
Simvastatin,https://www.drugs.com/simvastatin.html,"simvastatin belongs to a group of drugs called hmg coa reductase inhibitors, or ""statins."" simvastatin is used to lower blood levels of ""bad"" cholesterol (low-density lipoprotein, or ldl), to increase levels of ""good"" cholesterol (high-density lipoprotein, or hdl), and to lower triglycerides (a type of fat in the blood). simvastatin is also used to lower the risk of stroke, heart attack, and other heart complications in people with diabetes, coronary heart disease, or other risk factors. simvastatin is used in adults and children who are at least 10 years old."
Sinemet,https://www.drugs.com/mtm/sinemet.html,"sinemet is a combination medicine used to treat symptoms of parkinson's disease, such as muscle stiffness, tremors, spasms, and poor muscle control. parkinson's disease may be caused by low levels of a chemical called dopamine (doe pa meen) in the brain. sinemet is also used to treat parkinson symptoms caused by carbon monoxide poisoning or manganese intoxication. sinemet may also be used for purposes not listed in this medication guide."
Singulair,https://www.drugs.com/singulair.html,"singulair (montelukast) is a leukotriene (loo-koe-try-een) inhibitor. leukotrienes are chemicals your body releases when you breathe in an allergen (such as pollen). these chemicals cause swelling in your lungs and tightening of the muscles around your airways, which can result in asthma symptoms. singulair is used to prevent asthma attacks in adults and children as young as 12 months old. singulair is also used to prevent exercise-induced bronchoconstriction (narrowing of the air passages in the lungs) in adults and children who are at least 6 years old. singulair is also used to treat symptoms of year-round (perennial) allergies in adults and children who are at least 6 months old. it is also used to treat symptoms of seasonal allergies in adults and children who are at least 2 years old. singulair is used for allergies, only after other treatments have failed. if you already take singulair to prevent asthma or allergy symptoms, do not use an extra dose to treat exercise-induced bronchoconstriction."
Sitagliptin,https://www.drugs.com/mtm/sitagliptin.html,sitagliptin is used together with diet and exercise to improve blood sugar control in adults with type 2 diabetes mellitus. sitagliptin is not for treating type 1 diabetes. sitagliptin may also be used for purposes not listed in this medication guide.
Skelaxin,https://www.drugs.com/skelaxin.html,skelaxin (metaxalone) is a muscle relaxant. it works by blocking nerve impulses (or pain sensations) in the brain. skelaxin is used together with rest and physical therapy to treat skeletal muscle conditions such as pain or injury. skelaxin may also be used for purposes not listed in this medication guide.
Sodium bicarbonate,https://www.drugs.com/mtm/sodium-bicarbonate.html,sodium bicarbonate is an antacid that neutralizes stomach acid. sodium bicarbonate is used to relieve heartburn and indigestion. sodium bicarbonate may also be used for purposes not listed in this medication guide.
Solifenacin,https://www.drugs.com/mtm/solifenacin.html,"solifenacin is used to treat symptoms of overactive bladder, such as frequent or urgent urination, and incontinence (urine leakage). solifenacin may also be used for purposes not listed in this medication guide."
Soma,https://www.drugs.com/soma.html,soma (carisoprodol) is a muscle relaxer that blocks pain sensations between the nerves and the brain. soma is used together with rest and physical therapy to treat skeletal muscle conditions such as pain or injury. soma should only be used for short periods (up to two or three weeks) because there is no evidence of its effectiveness in long term use and most skeletal muscle injuries are generally of short duration.
Sonata,https://www.drugs.com/sonata.html,"sonata (zaleplon) is a sedative, also called a hypnotic. it affects chemicals in your brain that may be unbalanced in people with sleep problems (insomnia). sonata is used to treat insomnia. sonata causes relaxation to help you fall asleep and stay asleep."
Sotalol,https://www.drugs.com/mtm/sotalol.html,"sotalol is a beta-blocker that affects the heart and circulation within the atrium and ventricles (the upper and lower chambers of the heart that allow blood to flow into and out of the heart). sotalol is used to help keep the heart beating normally in people with certain heart rhythm disorders, such as atrial fibrillation, atrial flutter, ventricular tachycardia, and ventricular fibrillation. sotalol may also be used for purposes not listed in this medication guide."
Spiriva,https://www.drugs.com/spiriva.html,"spiriva (tiotropium) is a bronchodilator that relaxes muscles in the airways and increases air flow to the lungs. spiriva is used to prevent bronchospasm (narrowing of the airways in the lungs) in adults with copd (chronic obstructive pulmonary disease), including bronchitis and emphysema. spiriva respimat is also used to prevent asthma attacks in adults and children who are at least 6 years old. spiriva handihaler is not for use in children."
Spiriva Respimat,https://www.drugs.com/mtm/spiriva-respimat.html,"spiriva respimat is a bronchodilator that is used to prevent bronchospasm (narrowing of the airways in the lungs) in adults with copd (chronic obstructive pulmonary disease), including bronchitis and emphysema. spiriva respimat is also used to prevent asthma attacks in adults and children who are at least 6 years old. spiriva respimat may also be used for purposes not listed in this medication guide."
Spironolactone,https://www.drugs.com/spironolactone.html,"spironolactone is a potassium-sparing diuretic (water pill) that prevents your body from absorbing too much salt and keeps your potassium levels from getting too low. spironolactone is used to treat heart failure, high blood pressure (hypertension), or hypokalemia (low potassium levels in the blood). spironolactone also treats fluid retention (edema) in people with congestive heart failure, cirrhosis of the liver, or a kidney disorder called nephrotic syndrome. spironolactone is also used to diagnose or treat a condition in which you have too much aldosterone in your body. aldosterone is a hormone produced by your adrenal glands to help regulate the salt and water balance in your body."
Sprintec,https://www.drugs.com/mtm/sprintec.html,"sprintec is a combination birth control pill containing female hormones that prevent ovulation (the release of an egg from an ovary). sprintec also causes changes in your cervical mucus and uterine lining, making it harder for sperm to reach the uterus and harder for a fertilized egg to attach to the uterus. sprintec is used as contraception to prevent pregnancy. there are many available brands of this medicine. not all brands are listed on this leaflet. sprintec may also be used for purposes not listed in this medication guide."
Stelara,https://www.drugs.com/stelara.html,"stelara (ustekinumab) is an immunosuppressant that reduces the effects of a chemical substance in the body that can cause inflammation. stelara is used to treat plaque psoriasis in adults and children who are at least 6 years old. it is also used to treat psoriatic arthritis in adults, and is sometimes given with another medicine called methotrexate. stelara is used in adults to treat moderately to severely active crohn's disease after other medicines have been tried without success. stelara is also used in adults to treat moderately to severely active ulcerative colitis."
Stiolto Respimat,https://www.drugs.com/stiolto-respimat.html,"stiolto respima containes a combination of olodaterol and tiotropium. olodaterol is a long-acting bronchodilator. tiotropium is an anticholinergic. these medications work by relaxing muscles in the airways to improve breathing. stiolto respimat is used to prevent airflow obstruction and reduce flare-ups in adults with copd (chronic obstructive pulmonary disease), including bronchitis and emphysema. stiolto respimat will not treat a bronchospasm attack that has already begun. stiolto respimat is for use only in people with copd and should not be used to treat asthma."
