drugName,url,description
Librax,https://www.drugs.com/librax.html,"librax is a capsule containing a combination of chlordiazepoxide and clidinium. chlordiazepoxide is a benzodiazepine that affects chemicals in the brain that may be unbalanced. clidinium reduces stomach acid and decreases intestinal spasms. librax is a medicine that may be effective in treating stomach ulcers, irritable bowel syndrome, or symptoms related to intestinal infection. librax is given together with other medications to treat these conditions. the u.s. food and drug administration has determined that librax is ""possibly"" effective in treating these conditions."
Lidocaine,https://www.drugs.com/mtm/lidocaine-injection.html,"lidocaine is a local anesthetic (numbing medication) that is used to numb an area of your body to help reduce pain or discomfort caused by invasive medical procedures such as surgery, needle punctures, or insertion of a catheter or breathing tube. lidocaine injection is sometimes used to treat irregular heart rhythms that may signal a possible heart attack. lidocaine injection is also given in an epidural (spinal block) to reduce the discomfort of contractions during labor. lidocaine injection may also be used for purposes not listed in this medication guide."
Linaclotide,https://www.drugs.com/mtm/linaclotide.html,"linaclotide is used to treat chronic constipation, or chronic irritable bowel syndrome (ibs) in people who have had constipation as the main symptom. linaclotide may also be used for purposes not listed in this medication guide."
Linzess,https://www.drugs.com/linzess.html,"linzess (linaclotide) works by increasing the secretion of chloride and water in the intestines, which can soften stools and stimulate bowel movements. linzess is a prescription medicine used used to treat chronic constipation, or chronic irritable bowel syndrome (ibs) in people who have had constipation as the main symptom. the safety and effectiveness of linzess has not been established in patients under 18 years of age."
Lipitor,https://www.drugs.com/lipitor.html,"lipitor (atorvastatin) belongs to a group of drugs called hmg coa reductase inhibitors, or ""statins."" lipitor is used together with diet to lower blood levels of ""bad"" cholesterol (low-density lipoprotein, or ldl), to increase levels of ""good"" cholesterol (high-density lipoprotein, or hdl), and to lower triglycerides (a type of fat in the blood). lipitor is used to treat high cholesterol, and to lower the risk of stroke, heart attack, or other heart complications in people with type 2 diabetes, coronary heart disease, or other risk factors such as genetically high cholesterol. lipitor is for use in adults and children who are at least 10 years old."
Lisinopril,https://www.drugs.com/lisinopril.html,"lisinopril is an ace inhibitor. ace stands for angiotensin converting enzyme. lisinopril is used to treat high blood pressure (hypertension) in adults and children who are at least 6 years old. lisinopril is also used to treat congestive heart failure in adults, or to improve survival after a heart attack."
Lithium,https://www.drugs.com/lithium.html,"lithium affects the flow of sodium through nerve and muscle cells in the body. sodium affects excitation or mania. lithium a mood stabilizer that is a used to treat or control the manic episodes of bipolar disorder (manic depression). manic symptoms include hyperactivity, rushed speech, poor judgment, reduced need for sleep, aggression, and anger. lithium also helps to prevent or lessen the intensity of manic episodes. lithium is for use in adults and children at least 7 years old."
Lomotil,https://www.drugs.com/mtm/lomotil.html,"atropine affects the body in many different ways, such as reducing spasms in the bladder, stomach, and intestines. diphenoxylate is an antidiarrheal medication. lomotil is a combination medicine used to treat diarrhea in adults and children who are at least 13 years old. lomotil may also be used for purposes not listed in this medication guide."
Loperamide,https://www.drugs.com/mtm/loperamide.html,loperamide is used to treat diarrhea. loperamide is also used to reduce the amount of stool in people who have an ileostomy (re-routing of the bowel through a surgical opening in the stomach). loperamide may also be used for purposes not listed in this medication guide.
Lopid,https://www.drugs.com/mtm/lopid.html,"lopid helps reduce cholesterol and triglycerides (fatty acids) in the blood. high levels of these types of fat in the blood are associated with an increased risk of atherosclerosis (clogged arteries). lopid is used together with diet to treat very high cholesterol and triglyceride levels in people with pancreatitis. lopid is also used to lower the risk of stroke, heart attack, or other heart complications in certain people with high cholesterol and triglycerides who have not been helped by other treatment methods. lopid may also be used for purposes not listed in this medication guide."
Loratadine,https://www.drugs.com/loratadine.html,"loratadine is an antihistamine that reduces the effects of natural chemical histamine in the body. histamine can produce symptoms of sneezing, itching, watery eyes, and runny nose. loratadine is used to treat sneezing, runny nose, watery eyes, hives, skin rash, itching, and other cold or allergy symptoms. loratadine is also used to treat skin hives and itching in people with chronic skin reactions."
Lorazepam,https://www.drugs.com/lorazepam.html,"lorazepam belongs to a group of drugs called benzodiazepines. it is thought that lorazepam works by enhancing the activity of certain neurotransmitters in the brain. lorazepam is used to treat anxiety disorders and seizure disorders. it is dangerous to purchase lorazepam on the internet or outside the united states. the sale and distribution of medicines outside the u.s. does not comply with safe-use regulations of the food and drug administration (fda). these medications may contain dangerous ingredients, or may not be distributed by a licensed pharmacy."
Losartan,https://www.drugs.com/losartan.html,"losartan (cozaar) belongs to a group of drugs called angiotensin ii receptor antagonists. it keeps blood vessels from narrowing, which lowers blood pressure and improves blood flow. losartan is used to treat high blood pressure (hypertension). it is also used to lower the risk of stroke in certain people with heart disease. losartan is used to slow long-term kidney damage in people with type 2 diabetes who also have high blood pressure. losartan may also be used for purposes not listed in this medication guide."
Lovastatin,https://www.drugs.com/mtm/lovastatin.html,"lovastatin is used together with diet to lower blood levels of ""bad"" cholesterol (low-density lipoprotein, or ldl), to increase levels of ""good"" cholesterol (high-density lipoprotein, or hdl), and to lower triglycerides (a type of fat in the blood). lovastatin is used to lower the risk of stroke, heart attack, and other heart complications in adults with diabetes, coronary heart disease, or other risk factors. lovastatin may also be used for purposes not listed in this medication guide."
Lovenox,https://www.drugs.com/lovenox.html,"lovenox (enoxaparin) is an anticoagulant that helps prevent the formation of blood clots. lovenox is used to treat or prevent a type of blood clot called deep vein thrombosis (dvt), which can lead to blood clots in the lungs (pulmonary embolism). a dvt can occur after certain types of surgery, or in people who are bed-ridden due to a prolonged illness. lovenox is also used to prevent blood vessel complications in people with certain types of angina (chest pain) or heart attack."
Luvox,https://www.drugs.com/mtm/luvox.html,"luvox is a selective serotonin reuptake inhibitor (ssri) antidepressant. this medicine affects chemicals in the brain that may be unbalanced in people with obsessive-compulsive symptoms. luvox is used to treat social anxiety disorder (social phobia), or obsessive-compulsive disorders involving recurring thoughts or actions. luvox may also be used for purposes not listed in this medication guide."
Lyrica,https://www.drugs.com/lyrica.html,"lyrica (pregabalin) was originally fda approved as an anti-epileptic drug, also called an anticonvulsant. it works by slowing down impulses in the brain that cause seizures. pregabalin also affects chemicals in the brain that send pain signals across the nervous system. lyrica is used to treat pain caused by fibromyalgia, or nerve pain in people with diabetes (diabetic neuropathy), herpes zoster (post-herpetic neuralgia), or spinal cord injury. lyrica may also be used for purposes not listed in this medication guide."
Macrobid,https://www.drugs.com/macrobid.html,macrobid (nitrofurantoin) is an antibiotic that fights bacteria in the body. macrobid is used to treat urinary tract infections. macrobid may also be used for purposes not listed in this medication guide.
Macrodantin,https://www.drugs.com/mtm/macrodantin.html,macrodantin is an antibiotic that is used to treat urinary tract infections caused by bacteria. macrodantin may also be used for purposes not listed in this medication guide.
Magnesium citrate,https://www.drugs.com/mtm/magnesium-citrate.html,"magnesium is a naturally occurring mineral that is important for many systems in the body, especially the muscles and nerves. magnesium citrate also increases water in the intestines. magnesium citrate is used as a laxative to treat occasional constipation. magnesium citrate may also be used for purposes not listed in this medication guide."
Magnesium oxide,https://www.drugs.com/mtm/magnesium-oxide.html,"magnesium is a naturally occurring mineral. magnesium is important for many systems in the body especially the muscles and nerves. magnesium oxide is used as a supplement to maintain adequate magnesium in the body. magnesium oxide is also used as an antacid to treat indigestion, or as a laxative to relieve occasional constipation. magnesium oxide may also be used for purposes not listed in this medication guide."
Maxalt,https://www.drugs.com/maxalt.html,"maxalt (rizatriptan) is a headache medicine that narrows the blood vessels around the brain. rizatriptan also reduces substances in the body that can trigger headache pain, nausea, sensitivity to light and sound, and other migraine symptoms. maxalt is used to treat migraine headaches. maxalt will only treat a headache that has already begun. it will not prevent headaches or reduce the number of attacks. maxalt should not be used to treat a common tension headache, a headache that causes loss of movement on one side of your body, or any headache that seems to be different from your usual migraine headaches. use this medicine only if your condition has been confirmed by a doctor as migraine headaches."
Maxzide,https://www.drugs.com/mtm/maxzide.html,"hydrochlorothiazide is a thiazide diuretic (water pill) that helps prevent your body from absorbing too much salt, which can cause fluid retention. triamterene is a potassium-sparing diuretic that also prevents your body from absorbing too much salt and keeps your potassium levels from getting too low. maxzide is a combination medicine used to treat fluid retention (edema) and high blood pressure (hypertension). maxzide is usually given to people in whom other diuretics have caused hypokalemia (low potassium levels in your blood). maxzide may also be used for purposes not listed in this medication guide."
Meclizine,https://www.drugs.com/meclizine.html,"meclizine is an antihistamine that reduces the effects of natural chemical histamine in the body. meclizine is used to treat or prevent nausea, vomiting, and dizziness caused by motion sickness. it is also used to treat symptoms of vertigo (dizziness or spinning sensation) caused by disease that affects your inner ear. meclizine may also be used for purposes not listed in this medication guide."
Medrol,https://www.drugs.com/mtm/medrol.html,"medrol is a steroid that prevents the release of substances in the body that cause inflammation. medrol is used to treat many different inflammatory conditions such as arthritis, lupus, psoriasis, ulcerative colitis, allergic disorders, gland (endocrine) disorders, and conditions that affect the skin, eyes, lungs, stomach, nervous system, or blood cells. medrol may also be used for purposes not listed in this medication guide."
Medrol Dosepak,https://www.drugs.com/mtm/medrol-dosepak.html,"medrol dosepak is a steroid that prevents the release of substances in the body that cause inflammation. medrol dosepak is used to treat many different inflammatory conditions such as arthritis, lupus, psoriasis, ulcerative colitis, allergic disorders, gland (endocrine) disorders, and conditions that affect the skin, eyes, lungs, stomach, nervous system, or blood cells. medrol dosepak may also be used for purposes not listed in this medication guide."
Memantine,https://www.drugs.com/mtm/memantine.html,memantine reduces the actions of chemicals in the brain that may contribute to the symptoms of alzheimer's disease. memantine is used to treat moderate to severe dementia of the alzheimer's type. memantine may also be used for purposes not listed in this medication guide.
Mesalamine,https://www.drugs.com/mtm/mesalamine.html,"mesalamine affects a substance in the body that causes inflammation, tissue damage, and diarrhea. mesalamine is used to treat mild to moderate ulcerative colitis. mesalamine is also used to prevent the symptoms of ulcerative colitis from recurring. some brands of mesalamine are for use only in adults, and some brands are for use in children who are at least 5 years old. mesalamine may also be used for purposes not listed in this medication guide."
Metamucil,https://www.drugs.com/mtm/metamucil.html,metamucil is a bulk-forming fiber supplement with laxative properties. it used to treat occasional constipation or bowel irregularity. metamucil may also help lower cholesterol when used together with a diet low in cholesterol and saturated fat. metamucil may also be used for purposes not listed in this medication guide.
Metformin,https://www.drugs.com/metformin.html,"metformin is an oral diabetes medicine that helps control blood sugar levels. metformin is used together with diet and exercise to improve blood sugar control in adults with type 2 diabetes mellitus. metformin is sometimes used together with insulin or other medications, but it is not for treating type 1 diabetes."
Methadone,https://www.drugs.com/methadone.html,"methadone is an opioid medication. an opioid is sometimes called a narcotic. methadone reduces withdrawal symptoms in people addicted to heroin or other narcotic drugs without causing the ""high"" associated with the drug addiction. methadone is used as a pain reliever and as part of drug addiction detoxification and maintenance programs. it is available only from a certified pharmacy."
Methimazole,https://www.drugs.com/mtm/methimazole.html,methimazole prevents the thyroid gland from producing too much thyroid hormone. methimazole is used to treat hyperthyroidism (overactive thyroid). it is also used before thyroid surgery or radioactive iodine treatment. methimazole may also be used for purposes not listed in this medication guide.
Methocarbamol,https://www.drugs.com/methocarbamol.html,"methocarbamol is a muscle relaxer. it works by blocking nerve impulses (or pain sensations) that are sent to your brain. methocarbamol is used together with rest and physical therapy to treat skeletal muscle conditions such as pain or injury. methocarbamol injection is sometimes used in the treatment of tetanus, (lockjaw) which causes painful tightening of the muscles."
Methotrexate,https://www.drugs.com/methotrexate.html,"methotrexate interferes with the growth of certain cells of the body, especially cells that reproduce quickly, such as cancer cells, bone marrow cells, and skin cells. methotrexate is used to treat leukemia and certain types of cancer of the breast, skin, head and neck, lung, or uterus. methotrexate is also used to treat severe psoriasis and rheumatoid arthritis in adults. it is also used to treat active polyarticular-course juvenile rheumatoid arthritis in children. methotrexate is sometimes given when other medicines have not been effective."
Methylphenidate,https://www.drugs.com/methylphenidate.html,"methylphenidate is a central nervous system stimulant. it affects chemicals in the brain and nerves that contribute to hyperactivity and impulse control. methylphenidate is used to treat attention deficit disorder (add), attention deficit hyperactivity disorder (adhd), and narcolepsy. methylphenidate may also be used for purposes not listed in this medication guide."
Methylprednisolone,https://www.drugs.com/methylprednisolone.html,"methylprednisolone is a corticosteroid medicine that prevents the release of substances in the body that cause inflammation. methylprednisolone is used to treat many different inflammatory conditions such as arthritis, lupus, psoriasis, ulcerative colitis, allergic disorders, gland (endocrine) disorders, and conditions that affect the skin, eyes, lungs, stomach, nervous system, or blood cells. methylprednisolone may also be used for purposes not listed in this medication guide."
Metoclopramide,https://www.drugs.com/metoclopramide.html,"metoclopramide increases muscle contractions in the upper digestive tract. this speeds up the rate at which the stomach empties into the intestines. metoclopramide oral (taken by mouth) is used for 4 to 12 weeks to treat heartburn caused by gastroesophageal reflux in people who have used other medications without relief. metoclopramide oral is also used to treat gastroparesis (slow stomach emptying) in people with diabetes, which can cause heartburn and stomach discomfort after meals. metoclopramide injection is used to treat severe diabetic gastroparesis. the injection is also used to prevent nausea and vomiting caused by chemotherapy or surgery, or to aid in certain medical procedures involving the stomach or intestines."
Metolazone,https://www.drugs.com/mtm/metolazone.html,"metolazone is a thiazide diuretic (water pill) that helps prevent your body from absorbing too much salt, which can cause fluid retention. metolazone is used to treat fluid retention (edema) in people with congestive heart failure, or a kidney disorder such as nephrotic syndrome. metolazone is also used to treat high blood pressure (hypertension). metolazone may also be used for purposes not listed in this medication guide."
Metoprolol,https://www.drugs.com/metoprolol.html,metoprolol is a beta-blocker that affects the heart and circulation (blood flow through arteries and veins). metoprolol is used to treat angina (chest pain) and hypertension (high blood pressure). metoprolol is also used to lower your risk of death or needing to be hospitalized for heart failure. metoprolol injection is used during the early phase of a heart attack to lower the risk of death.
Metronidazole,https://www.drugs.com/metronidazole.html,"metronidazole is an antibiotic that fights bacteria. metronidazole is used to treat bacterial infections of the vagina, stomach or intestines, liver, skin, joints, brain, heart, and respiratory tract. metrogel (topical metronidazole) is also used to treat rosacea, a skin condition. vaginal metronidazole gel is also used to treat bacterial infections of the vagina. metronidazole will not treat a vaginal yeast infection."
Midodrine,https://www.drugs.com/mtm/midodrine.html,"midodrine works by constricting (narrowing) the blood vessels and increasing blood pressure. midodrine is used to treat low blood pressure (hypotension) that causes severe dizziness or a light-headed feeling, like you might pass out. midodrine is for use only when low blood pressure affects daily life. midodrine may not improve your ability to perform daily activities. midodrine may also be used for purposes not listed in this medication guide."
Minocycline,https://www.drugs.com/minocycline.html,"minocycline is a tetracycline antibiotic that fights bacteria in the body. minocycline is used to treat many different bacterial infections, such as urinary tract infections, respiratory infections, skin infections, severe acne, chlamydia, tick fever, and others. it is also used for gonorrhoea, syphilis, and other infections as a second-line drug in those with a penicillin allergy. minocycline may also be used for purposes not listed in this medication guide."
Mirtazapine,https://www.drugs.com/mirtazapine.html,mirtazapine is an antidepressant. the way this medication works is still not fully understood. it is thought to positively affect communication between nerve cells in the central nervous system and/or restore chemical balance in the brain. mirtazapine is used to treat major depressive disorder in adults. it is not known if mirtazapine is safe and effective for use to treat mdd in children.
Mobic,https://www.drugs.com/mobic.html,mobic (meloxicam) is a nonsteroidal anti-inflammatory drug (nsaid). meloxicam works by reducing hormones that cause inflammation and pain in the body. mobic is used to treat pain or inflammation caused by rheumatoid arthritis and osteoarthritis in adults. mobic is also used to treat juvenile rheumatoid arthritis in children who are at least 2 years old. mobic may also be used for purposes not listed in this medication guide.
Modafinil,https://www.drugs.com/mtm/modafinil.html,"modafinil is a medication that promotes wakefulness. modafinil is used to treat excessive sleepiness caused by sleep apnea, narcolepsy, or shift work sleep disorder. modafinil may also be used for purposes not listed in this medication guide."
Montelukast,https://www.drugs.com/mtm/montelukast.html,"montelukast is a leukotriene (loo-koe-try-een) inhibitor. leukotrienes are chemicals your body releases when you breathe in an allergen (such as pollen). these chemicals cause swelling in your lungs and tightening of the muscles around your airways, which can result in asthma symptoms. montelukast is used to prevent asthma attacks in adults and children as young as 12 months old. montelukast is also used to prevent exercise-induced bronchoconstriction (narrowing of the air passages in the lungs) in adults and children who are at least 6 years old. montelukast is also used to treat symptoms of year-round (perennial) allergies in adults and children who are at least 6 months old. it is also used to treat symptoms of seasonal allergies in adults and children who are at least 2 years old. montelukast is used for allergies, only after other treatments have failed. if you already take montelukast to prevent asthma or allergy symptoms, do not use an extra dose to treat exercise-induced bronchoconstriction. montelukast may also be used for purposes not listed in this medication guide."
Morphine,https://www.drugs.com/morphine.html,morphine is an opioid medication. an opioid is sometimes called a narcotic. morphine is used to treat moderate to severe pain. short-acting formulations are taken as needed for pain. the extended-release form of morphine is for around-the-clock treatment of pain. this form of morphine is not for use on an as-needed basis for pain.
Motrin,https://www.drugs.com/motrin.html,"motrin (ibuprofen) is a nonsteroidal anti-inflammatory drug (nsaid). ibuprofen works by reducing hormones that cause inflammation and pain in the body. motrin is used to reduce fever and treat pain or inflammation caused by many conditions such as headache, toothache, back pain, arthritis, menstrual cramps, or minor injury. motrin is fda-approved for adults and children who are at least 6 months old."
Mucinex,https://www.drugs.com/mucinex.html,"mucinex (guaifenesin) is an expectorant. it helps loosen congestion in your chest and throat, making it easier to cough out through your mouth. mucinex is used to reduce chest congestion caused by the common cold, infections, or allergies. mucinex may also be used for purposes not listed in this medication guide."
Multaq,https://www.drugs.com/multaq.html,"multaq (dronedarone) is a heart rhythm medicine that helps maintain normal heartbeats in certain people with life-threatening rhythm disorders of the atrium (the upper chambers of the heart that allow blood to flow into the heart). multaq helps lower your risk of needing to be hospitalized for a heart rhythm disorder called atrial fibrillation. multaq is for people who have had this disorder in the past, but now have normal heart rhythm."
Mupirocin topical,https://www.drugs.com/mtm/mupirocin-topical.html,"mupirocin is an antibiotic that prevents bacteria from growing on your skin. mupirocin topical (for use on the skin) is used to treat skin infections such as impetigo (im-pe-tye-go) or a ""staph"" infection of the skin. mupirocin topical may also be used for purposes not listed in this medication guide."
Myrbetriq,https://www.drugs.com/myrbetriq.html,"myrbetriq (mirabegron) relaxes the muscles of the urinary bladder, reducing bladder spasms. myrbetriq is used to treat the symptoms of overactive bladder, such as frequent or urgent urination and urinary incontinence. myrbetriq is often used in combination with another overactive bladder medicine, solifenacin. myrbetriq may also be used for purposes not listed in this medication guide."
Nabumetone,https://www.drugs.com/mtm/nabumetone.html,nabumetone is a nonsteroidal anti-inflammatory drug (nsaid). nabumetone works by reducing hormones that cause inflammation and pain in the body. nabumetone is used to relieve the symptoms of rheumatoid arthritis or osteoarthritis. nabumetone may also be used for purposes not listed in this medication guide.
