drugName,url,description
Abilify,https://www.drugs.com/abilify.html,"abilify (aripiprazole is an antipsychotic medication. it works by changing the actions of chemicals in the brain. abilify is used to treat the symptoms of psychotic conditions such as schizophrenia and bipolar i disorder (manic depression). it is not known if aripiprazole is safe or effective in children younger than 13 with schizophrenia, or children younger than 10 with bipolar disorder. abilify is also used together with other medicines to treat major depressive disorder in adults. abilify is also used in children 6 years or older who have tourette's disorder, or symptoms of autistic disorder (irritability, aggression, mood swings, temper tantrums, and self-injury)."
Accupril,https://www.drugs.com/accupril.html,accupril (quinapril) is an ace inhibitor. ace stands for angiotensin converting enzyme. accupril is used to treat high blood pressure (hypertension). lowering blood pressure may lower your risk of a stroke or heart attack. accupril is also used together with other medications to treat heart failure.
Acetaminophen,https://www.drugs.com/acetaminophen.html,"acetaminophen is a pain reliever and a fever reducer. acetaminophen is used to treat mild to moderate and pain, to treat moderate to severe pain in conjunction with opiates, or to reduce fever. common conditions that acetaminophen treats include headache, muscle aches, arthritis, backache, toothaches, sore throat, colds, flu, and fevers. acetaminophen may also be used for purposes not listed in this medication guide. it is typically used orally, but can be given intravenously."
Aciphex,https://www.drugs.com/aciphex.html,"aciphex (rabeprazole) is a proton pump inhibitor that decreases the amount of acid produced in the stomach. aciphex is used short-term to treat symptoms of gastroesophageal reflux disease (gerd) in adults and children who are at least 1 year old. aciphex is used only in adults to treat conditions involving excessive stomach acid, such as zollinger-ellison syndrome. it is also used in adults to promote healing of duodenal ulcers or erosive esophagitis (damage to your esophagus caused by stomach acid). aciphex may also be given with an antibiotic to prevent duodenal ulcer caused by infection with helicobacter pylori (h. pylori). aciphex is not for immediate relief of heartburn symptoms."
Acyclovir,https://www.drugs.com/acyclovir.html,"acyclovir is an antiviral drug. it slows the growth and spread of the herpes virus in the body. it will not cure herpes, but it can lessen the symptoms of the infection. acyclovir is used to treat infections caused by herpes viruses, such as genital herpes, cold sores, shingles, and chickenpox. sitavig (acyclovir tablet, delayed release) is only for use in treating cold sores on the lips. sitavig will not treat genital herpes."
Adderall,https://www.drugs.com/adderall.html,adderall contains a combination of amphetamine and dextroamphetamine. amphetamine and dextroamphetamine are central nervous system stimulants that affect chemicals in the brain and nerves that contribute to hyperactivity and impulse control. adderall is used to treat attention deficit hyperactivity disorder (adhd) and narcolepsy. adderall may also be used for purposes not listed in this medication guide.
Advair Diskus,https://www.drugs.com/mtm/advair-diskus.html,"advair diskus inhalation is a steroid and bronchodilator combination medicine that is used to prevent asthma attacks. it is also used to prevent flare-ups or worsening of chronic obstructive pulmonary disease (copd) associated with chronic bronchitis and/or emphysema. in people with copd, advair diskus is for long-term treatment. in people with asthma, advair diskus is for short-term treatment until symptoms are well controlled with with other medicines. advair diskus is for use in adults and children who are at least 4 years old. advair hfa and airduo respiclick are for use in adults and children who are at least 12 years old. advair diskus may also be used for purposes not listed in this medication guide."
Advil,https://www.drugs.com/advil.html,"advil (ibuprofen) is a nonsteroidal anti-inflammatory drug (nsaid). ibuprofen works by reducing hormones that cause inflammation and pain in the body. advil is used to reduce fever and treat pain or inflammation caused by many conditions such as headache, toothache, back pain, arthritis, menstrual cramps, or minor injury. advil is used in adults and children who are at least 6 months old."
Aimovig,https://www.drugs.com/aimovig.html,"aimovig (erenumab) is a monoclonal antibody that blocks the activation of a certain protein that can produce a migraine attack. this protein, called calcitonin gene- related peptide (cgrp), can cause blood vessels to dilate and cause inflammation and migraine headache pain. aimovig is a prescription medicine used for the preventive treatment of migraine in adults. aimovig may also be used for purposes not listed in this medication guide."
Albuterol,https://www.drugs.com/albuterol.html,"albuterol is a bronchodilator that relaxes muscles in the airways and increases air flow to the lungs. albuterol inhalation is used to treat or prevent bronchospasm, or narrowing of the airways in the lungs, in people with asthma or certain types of chronic obstructive pulmonary disease (copd). it is also used to prevent exercise-induced bronchospasm. albuterol inhalation is for use in adults and children who are at least 4 years old. some brands or forms of this medicine are not for use in children younger than 12 years old. always follow your doctor's directions when giving albuterol to a child."
Aldactone,https://www.drugs.com/aldactone.html,"aldactone (spironolactone) is a potassium-sparing diuretic (water pill) that prevents your body from absorbing too much salt and keeps your potassium levels from getting too low. aldactone is used to treat heart failure, high blood pressure (hypertension), or hypokalemia (low potassium levels in the blood). aldactone also treats fluid retention (edema) in people with congestive heart failure, cirrhosis of the liver, or a kidney disorder called nephrotic syndrome. aldactone is also used to diagnose or treat a condition in which you have too much aldosterone in your body. aldosterone is a hormone produced by your adrenal glands to help regulate the salt and water balance in your body."
Alendronate,https://www.drugs.com/mtm/alendronate.html,"alendronate is used to treat osteoporosis caused by menopause, steroid use, or gonadal failure. alendronate is for use when you have a high risk of bone fracture due to osteoporosis. alendronate is also used to treat paget's disease of bone. alendronate may also be used for purposes not listed in this medication guide."
Aleve,https://www.drugs.com/aleve.html,"aleve (naproxen) is a nonsteroidal anti-inflammatory drug (nsaid). naproxen works by reducing hormones that cause inflammation and pain in the body. aleve is used to temporarily relieve minor aches and pains due to arthritis, muscular aches, backache, menstrual cramps, headache, toothache,and the common cold. aleve is also used to temporarily reduce fever. aleve may also be used for purposes not listed in this medication guide."
Allopurinol,https://www.drugs.com/allopurinol.html,"allopurinol reduces the production of uric acid in your body. uric acid buildup can lead to gout or kidney stones. allopurinol is used to treat gout or kidney stones, and to decrease levels of uric acid in people who are receiving cancer treatment. allopurinol may also be used for purposes not listed in this medication guide."
Alprazolam,https://www.drugs.com/alprazolam.html,"alprazolam is a benzodiazepine (ben-zoe-dye-aze-eh-peen). it is thought that alprazolam works by enhancing the activity of certain neurotransmitters in the brain. alprazolam is used to treat anxiety disorders, panic disorders, and anxiety caused by depression. it is dangerous to purchase alprazolam on the internet or outside the united states. the sale and distribution of medicines outside the u.s. does not comply with safe-use regulations of the food and drug administration (fda). these medications may contain dangerous ingredients, or may not be distributed by a licensed pharmacy."
Ambien,https://www.drugs.com/ambien.html,"ambien (zolpidem) is a sedative, also called a hypnotic. zolpidem affects chemicals in the brain that may be unbalanced in people with sleep problems insomnia). ambien is used to treat insomnia. the immediate-release tablet is used to help you fall asleep when you first go to bed. the extended-release form, ambien cr, which has a first layer that dissolves quickly to help you fall asleep, and a second layer that dissolves slowly to help you stay asleep. your doctor will determine which form of ambien is best for you."
Amiodarone,https://www.drugs.com/amiodarone.html,amiodarone affects the rhythm of your heartbeats. it is used to help keep the heart beating normally in people with life-threatening heart rhythm disorders of the ventricles (the lower chambers of the heart that allow blood to flow out of the heart). amiodarone is used to treat ventricular tachycardia or ventricular fibrillation. amiodarone is for use only in treating life-threatening heart rhythm disorders.
Amitiza,https://www.drugs.com/amitiza.html,"amitiza (lubiprostone) increases the secretion of fluid in your intestines to help make it easier to pass stools (bowel movements). amitiza is used to treat chronic chronic constipation, or constipation caused by opioid (narcotic) pain medicine. amitiza may also be used to treat irritable bowel syndrome in women with constipation as the main symptom. amitiza is only for use in adults."
Amitriptyline,https://www.drugs.com/amitriptyline.html,amitriptyline is a tricyclic antidepressant with sedative effects. amitriptyline affects certain chemical messengers (neurotransmitters) that communicate between brain cells and help regulate mood. amitriptyline is a prescription medicine used to treat symptoms of depression. amitriptyline may also be used for purposes not listed in this medication guide.
Amlodipine,https://www.drugs.com/amlodipine.html,amlodipine is a calcium channel blocker that dilates (widens) blood vessels and improves blood flow. amlodipine is used to treat chest pain (angina) and other conditions caused by coronary artery disease. amlodipine is also used to treat high blood pressure (hypertension). lowering blood pressure may lower your risk of a stroke or heart attack. amlodipine is for use in adults and children who are at least 6 years old.
Amoxicillin,https://www.drugs.com/amoxicillin.html,"amoxicillin is a penicillin antibiotic that fights bacteria. amoxicillin is used to treat many different types of infection caused by bacteria, such as tonsillitis, bronchitis, pneumonia, and infections of the ear, nose, throat, skin, or urinary tract. amoxicillin is also sometimes used together with another antibiotic called clarithromycin (biaxin) to treat stomach ulcers caused by helicobacter pylori infection. this combination is sometimes used with a stomach acid reducer called lansoprazole (prevacid)."
Amoxicillin and Clavulanate,https://www.drugs.com/amoxicillin_clavulanate.html,"amoxicillin and clavulanate potassium is a combination prescription antibiotic. amoxicillin is a penicillin antibiotic that fights bacteria in the body. clavulanate potassium is a beta-lactamase inhibitor that helps prevent certain bacteria from becoming resistant to amoxicillin. amoxicillin and clavulanate potassium is used to treat many different infections caused by bacteria, such as , pneumonia, ear infections, bronchitis, urinary tract infections, and infections of the skin."
Amphetamine and dextroamphetamine,https://www.drugs.com/mtm/amphetamine-and-dextroamphetamine.html,amphetamine and dextroamphetamine are central nervous system stimulants that affect chemicals in the brain and nerves that contribute to hyperactivity and impulse control. amphetamine and dextroamphetamine is a combination medicine used to treat narcolepsy and attention deficit hyperactivity disorder (adhd). amphetamine and dextroamphetamine may also be used for purposes not listed in this medication guide.
Anastrozole,https://www.drugs.com/mtm/anastrozole.html,"anastrozole lowers estrogen levels in postmenopausal women, which may slow the growth of certain types of breast tumors that need estrogen to grow in the body. anastrozole is used to treat breast cancer in postmenopausal women. it is often given to women whose cancer has progressed even after taking tamoxifen (nolvadex, soltamox). anastrozole may also be used for purposes not listed in this medication guide."
Antivert,https://www.drugs.com/antivert.html,"antivert (meclizine) is an antihistamine that reduces the effects of natural chemical histamine in the body. antivert is used to treat or prevent nausea, vomiting, and dizziness caused by motion sickness. antivert is also used to treat symptoms of vertigo (dizziness or spinning sensation) caused by disease that affects your inner ear."
Apixaban,https://www.drugs.com/mtm/apixaban.html,"apixaban is used to lower the risk of stroke caused by a blood clot in people with a heart rhythm disorder called atrial fibrillation. apixaban is also used after hip or knee replacement surgery to prevent a type of blood clot called deep vein thrombosis (dvt), which can lead to blood clots in the lungs (pulmonary embolism). apixaban is also used to treat dvt or pulmonary embolism (pe), and to lower your risk of having a repeat dvt or pe. apixaban may also be used for purposes not listed in this medication guide."
Aricept,https://www.drugs.com/aricept.html,"aricept (donepezil) improves the function of nerve cells in the brain. it works by preventing the breakdown of a chemical called acetylcholine (ah seet il koe leen). people with dementia usually have lower levels of this chemical, which is important for the processes of memory, thinking, and reasoning. aricept is used to treat mild to moderate dementia caused by alzheimer's disease. aricept is not a cure for alzheimer's disease. this condition will progress over time, even in people who take donepezil."
Arimidex,https://www.drugs.com/arimidex.html,"arimidex (anastrozole) lowers estrogen levels in postmenopausal women, which may slow the growth of certain types of breast tumors that need estrogen to grow in the body. arimidex is used to treat breast cancer in postmenopausal women. arimidex is often given to women whose cancer has progressed even after taking tamoxifen (nolvadex, soltamox)."
Aripiprazole,https://www.drugs.com/aripiprazole.html,"aripiprazole is an antipsychotic medicine that is used to treat the symptoms of psychotic conditions such as schizophrenia and bipolar i disorder (manic depression). it is not known if aripiprazole is safe or effective in children younger than 13 with schizophrenia, or children younger than 10 with bipolar disorder. aripiprazole is also used together with other medicines to treat major depressive disorder in adults. aripiprazole is also used in children 6 years or older who have tourette's disorder, or symptoms of autistic disorder (irritability, aggression, mood swings, temper tantrums, and self-injury)."
Armour Thyroid,https://www.drugs.com/mtm/armour-thyroid.html,"desiccated (dried) thyroid is a combination of hormones that are normally produced by your thyroid gland to regulate the body's energy and metabolism. desiccated thyroid is given when the thyroid does not produce enough of this hormone on its own. desiccated thyroid treats hypothyroidism (low thyroid hormone). desiccated thyroid is also used to treat or prevent goiter (enlarged thyroid gland), and is also given as part of a medical tests for thyroid disorders. desiccated thyroid should not be used to treat obesity or weight problems. desiccated thyroid may also be used for purposes not listed in this medication guide."
Ascorbic acid,https://www.drugs.com/mtm/ascorbic-acid.html,"ascorbic acid (vitamin c) occurs naturally in foods such as citrus fruit, tomatoes, potatoes, and leafy vegetables. vitamin c is important for bones and connective tissues, muscles, and blood vessels. vitamin c also helps the body absorb iron, which is needed for red blood cell production. ascorbic acid is used to treat and prevent vitamin c deficiency. ascorbic acid may also be used for purposes not listed in this medication guide."
Aspir 81,https://www.drugs.com/mtm/aspir-81.html,"aspir 81 is a salicylate (sa-lis-il-ate) that is used to treat pain, and reduce fever or inflammation. aspir 81 is sometimes used to treat or prevent heart attacks, strokes, and chest pain (angina). this medicine should be used for cardiovascular conditions only under the supervision of a doctor. aspir 81 may also be used for purposes not listed in this medication guide."
Aspirin,https://www.drugs.com/aspirin.html,"aspirin is a salicylate (sa-lis-il-ate). it works by reducing substances in the body that cause pain, fever, and inflammation. aspirin is used to treat pain, and reduce fever or inflammation. it is sometimes used to treat or prevent heart attacks, strokes, and chest pain (angina). aspirin should be used for cardiovascular conditions only under the supervision of a doctor."
Atenolol,https://www.drugs.com/atenolol.html,atenolol (tenormin) is a beta-blocker that affects the heart and circulation (blood flow through arteries and veins). atenolol is used to treat angina (chest pain) and hypertension (high blood pressure). atenolol is also used to lower the risk of death after a heart attack.
Ativan,https://www.drugs.com/ativan.html,"ativan (lorazepam) belongs to a group of drugs called benzodiazepines. it is thought that lorazepam works by enhancing the activity of certain neurotransmitters in the brain. ativan is used to treat anxiety disorders and seizure disorders. it is dangerous to purchase ativan on the internet or outside the united states. the sale and distribution of medicines outside the u.s. does not comply with safe-use regulations of the food and drug administration (fda). these medications may contain dangerous ingredients, or may not be distributed by a licensed pharmacy."
Atorvastatin,https://www.drugs.com/atorvastatin.html,"atorvastatin belongs to a group of drugs called hmg coa reductase inhibitors, or ""statins."" atorvastatin is used together with diet to lower blood levels of ""bad"" cholesterol (low-density lipoprotein, or ldl), to increase levels of ""good"" cholesterol (high-density lipoprotein, or hdl), and to lower triglycerides (a type of fat in the blood). atorvastatin is used to treat high cholesterol, and to lower the risk of stroke, heart attack, or other heart complications in people with type 2 diabetes, coronary heart disease, or other risk factors. atorvastatin is used in adults and children who are at least 10 years old."
Augmentin,https://www.drugs.com/augmentin.html,"augmentin contains a combination of amoxicillin and clavulanate potassium. amoxicillin is a penicillin antibiotic that fights bacteria in the body. clavulanate potassium is a beta-lactamase inhibitor that helps prevent certain bacteria from becoming resistant to amoxicillin. augmentin is prescription antibiotic used to treat many different infections caused by bacteria, such as , pneumonia, ear infections, bronchitis, urinary tract infections, and infections of the skin."
Azelastine,https://www.drugs.com/mtm/azelastine-nasal.html,"azelastine nasal (for the nose) is an antihistamine that treats sneezing, runny or stuffy nose, itching, and other nasal symptoms of allergies, in adults and children who are at least 5 years old. azelastine nasal is also used to treat ongoing nasal symptoms (runny or stuffy nose, sneezing, itching) that are not caused by allergies, in adults and children who are at least 12 years old. azelastine nasal may also be used for purposes not listed in this medication guide."
Azithromycin,https://www.drugs.com/azithromycin.html,"azithromycin is an antibiotic that fights bacteria. azithromycin is used to treat many different types of infections caused by bacteria, such as respiratory infections, skin infections, ear infections, eye infections, and sexually transmitted diseases. azithromycin may also be used for purposes not listed in this medication guide."
Bacitracin,https://www.drugs.com/mtm/bacitracin-ophthalmic.html,bacitracin is an antibiotic that kills bacteria. bacitracin ophthalmic (for the eyes) is used to treat bacterial infections of the eyes. bacitracin ophthalmic may also be used for purposes not listed in this medication guide.
Baclofen,https://www.drugs.com/baclofen.html,"baclofen is a muscle relaxer and an antispasmodic agent. baclofen is used to treat muscle pain, spasms, and stiffness in people with multiple sclerosis or spinal cord injury or disease. baclofen is given intrathecally (directly into the spinal cord) or orally (by mouth)."
Bactrim,https://www.drugs.com/bactrim.html,"bactrim contains a combination of sulfamethoxazole and trimethoprim. sulfamethoxazole and trimethoprim are are both antibiotics that treat different types of infection caused by bacteria. bactrim is used to treat ear infections, urinary tract infections, bronchitis, traveler's diarrhea, shigellosis, and pneumocystis jiroveci pneumonia. bactrim may also be used for purposes not listed in this medication guide."
Basaglar,https://www.drugs.com/basaglar.html,"basaglar (insulin glargine) is a long-acting insulin that starts to work several hours after injection and keeps working evenly for 24 hours. insulin is a hormone that works by lowering levels of glucose (sugar) in the blood. basaglar is used to improve blood sugar control in adults and children with diabetes mellitus. basaglar is for use in adults with type 1 or type 2 diabetes, and in children at least 6 years old with type 1 diabetes. some brands of insulin glargine are for use only in adults. carefully follow all instructions for the brand of insulin glargine you are using."
Belbuca,https://www.drugs.com/belbuca.html,"belbuca buccal films contain buprenorphine, an opioid medication. an opioid is sometimes called a narcotic. belbuca buccal films are for around-the-clock treatment of moderate to severe chronic pain that is not controlled by other medicines. belbuca is not for use on an as-needed basis for occasional pain. the belbuca buccal film is placed between the gum and cheek where it adheres to the moist buccal mucosa to deliver the medicine as the film dissolves."
Belsomra,https://www.drugs.com/belsomra.html,belsomra (suvorexant) is a sleep medicine that helps regulate your sleep and wake cycle. belsomra is used to treat insomnia (trouble falling asleep or staying asleep). belsomra may also be used for purposes not listed in this medication guide.
Benadryl,https://www.drugs.com/benadryl.html,"benadryl (diphenhydramine) is an antihistamine that reduces the effects of natural chemical histamine in the body. histamine can produce symptoms of sneezing, itching, watery eyes, and runny nose. benadryl is used to treat sneezing, runny nose, watery eyes, hives, skin rash, itching, and other cold or allergy symptoms. benadryl is also used to treat motion sickness, to induce sleep, and to treat certain symptoms of parkinson's disease."
Benazepril,https://www.drugs.com/mtm/benazepril.html,benazepril is an ace inhibitor that is used to treat high blood pressure (hypertension). lowering blood pressure may lower your risk of a stroke or heart attack. benazepril may also be used for purposes not listed in this medication guide.
Benicar,https://www.drugs.com/benicar.html,"benicar (olmesartan) is an angiotensin ii receptor antagonist. olmesartan keeps blood vessels from narrowing, which lowers blood pressure and improves blood flow. benicar is used to treat high blood pressure (hypertension) in adults and children who are at least 6 years old. benicar is sometimes given together with other blood pressure medications."
Bentyl,https://www.drugs.com/mtm/bentyl.html,bentyl relieves spasms of the muscles in the stomach and intestines. bentyl is used to treat functional bowel or irritable bowel syndrome. bentyl may also be used for purposes not listed in this medication guide.
Benzonatate,https://www.drugs.com/benzonatate.html,"benzonatate is a non-narcotic cough medicine. benzonatate works by numbing the throat and lungs, making the cough reflex less active. benzonatate is used to relieve coughing."
Benztropine,https://www.drugs.com/mtm/benztropine.html,"benztropine reduces the effects of certain chemicals in the body that may be unbalanced as a result of disease (such as parkinson's), drug therapy, or other causes. benztropine is used together with other medicines to treat the symptoms of parkinson's disease (muscle spasms, stiffness, tremors, poor muscle control). benztropine is also used to treat and prevent these symptoms when they are caused by drugs such as chlorpromazine (thorazine), fluphenazine (prolixin), perphenazine (trilafon), and others. benztropine may also be used for purposes not listed in this medication guide."
Betamethasone,https://www.drugs.com/betamethasone-topical.html,"betamethasone is a highly potent steroid that prevents the release of substances in the body that cause inflammation. betamethasone topical (for the skin) is used to treat the inflammation and itching caused by a number of skin conditions such as eczema or psoriasis. betamethasone topical is available in a cream, gel, ointment, lotion, foam or spray."
